{
  "decision": "needs_review",
  "confidence": null,
  "review_started_at": null,
  "review_ended_at": null,
  "review_duration_minutes": null,
  "missing_context_count": 0,
  "clarification_request_count": 0,
  "missed_regression_count": 0,
  "re_review_count": 0,
  "reusable_by_another_agent": null,
  "reproduction_success": true,
  "time_to_understand_minutes": null,
  "notes": [
    "OpenCode/Copilot attempted the run with github-copilot/gpt-5-mini.",
    "The executor made a small external-workspace change and reported targeted tests passing with --net-pypiserver.",
    "artifact.fpk exists but is a tar/gzip file, not a valid filepacks artifact.",
    "Run preserved as incomplete with invalid artifact packaging."
  ]
}
